{
  "exportId": "export-500123",
  "exportStatus": "SUCCEEDED",
  "statusMessage": "Export complete",
  "configurationsDownloadUrl": "https://s3.amazonaws.com/aws-application-discovery-service-export/500123/export.zip",
  "exportRequestTime": "2026-04-19T10:00:00Z",
  "isTruncated": false,
  "requestedStartTime": "2026-04-01T00:00:00Z",
  "requestedEndTime": "2026-04-19T23:59:59Z"
}